Title,Date,Author,Link,Content
 Đắk Nông phản hồi về tình trạng rừng phòng hộ Gia Nghĩa bị đốt cháy ,"Thứ hai, ngày 27/03/2023 - 14:27",CHẤN HƯNG - KHẢI HOÀN,https://nhandan.vn/dak-nong-phan-hoi-ve-tinh-trang-rung-phong-ho-gia-nghia-bi-dot-chay-post744897.html,"Theo đó, Sở Nông nghiệp và Phát triển Nông thôn tỉnh Đắk Nông khẳng định nội dung Báo Nhân Dân phản ánh là đúng. Đồng thời, cơ quan này này cũng cho biết, tình trạng nhiều khoảnh rừng thuộc lâm phần quản lý của Ban quản lý rừng phòng hộ Gia Nghĩa bị cháy bất thường. Cùng với đó là một lượng lớn đinh các loại được chôn, rải dọc đường tuần tra nhằm ngăn chặn lực lượng phòng cháy, chữa cháy rừng dập lửa là hành động có chủ đích của các đối tượng phá hoại.Sở Nông nghiệp và Phát triển Nông thôn tỉnh Đắk Nông cảm ơn Báo Nhân Dân đã quan tâm, kịp thời đưa tin, bài phản ánh, góp phần giúp cơ quan chức năng, chính quyền địa phương nâng cao trách nhiệm quản lý Nhà nước, bảo đảm chấp hành pháp luật về lâm nghiệp.Cũng theo Sở Nông nghiệp và Phát triển Nông thôn Đắk Nông, lâm phần Ban quản lý rừng phòng hộ Gia Nghĩa quản lý là “điểm nóng” về phá rừng trái pháp luật, Sở Nông nghiệp và Phát triển nông thôn yêu cầu Chi cục Kiểm lâm chỉ đạo Đội kiểm lâm cơ động và phòng cháy, chữa cháy rừng phối hợp Hạt Kiểm lâm thành phố Gia Nghĩa, xây dựng kế hoạch, cắm chốt 24/24 (từ ngày 7/2/2023) nhằm hỗ trợ lực lượng giúp Ban Quản lý rừng phòng hộ Gia Nghĩa tuần tra, kiểm tra, ngăn chặn, xử lý các hành vi vi phạm pháp Luật Lâm nghiệp.Ngoài ra, từ đầu năm đến nay, Ban quản lý rừng phòng hộ Gia Nghĩa xây dựng 3 kế hoạch, thành lập các tổ chốt chặn tại các khu vực trọng điểm phá rừng, lấn chiếm đất lâm nghiệp, nhằm kịp thời ngăn chặn tình trạng vi phạm pháp luật lâm nghiệp; kiểm soát người và phương tiện ra vào rừng.Qua kết quả kiểm tra xác định có 5 lô rừng trồng bị đốt, thiệt hại 60-90%, là khu vực thuộc dự án trồng rừng thay thế năm 2018, 2019 với diện tích 4,680ha.Hiện, Ban quản lý rừng phòng hộ Gia Nghĩa đang phối hợp cơ quan chức năng, chính quyền địa phương xác minh, xử lý theo quy định.Ủy ban nhân dân tỉnh Đắk Nông đã thành lập Ban chỉ đạo giải quyết các vấn đề tồn tại trong lĩnh vực lâm nghiệp, quản lý đất đai, đối với diện tích các công ty nông, lâm nghiệp để sớm giải quyết dứt điểm tình trạng này."
" Bệnh viện đa khoa Hà Đông: Tăng 30% trẻ khám, điều trị do mắc thủy đậu ","Thứ hai, ngày 27/03/2023 - 13:38",TRẦN LAM-THANH HƯƠNG-QUANG NAM,https://nhandan.vn/benh-vien-da-khoa-ha-dong-tang-30-tre-kham-dieu-tri-do-mac-thuy-dau-post744890.html,"Gia tăng trẻ mắc thủy đậu nhập việnBế cô con gái mới 2 tuổi trên tay, chị Triệu Thị Nh. (Ba La, Hà Đông) cho biết, con gái chị có triệu chứng sốt từ 3 ngày trước, sau đó thấy những ban tròn đỏ nổi lên. Cứ nghĩ con bị côn trùng đốt, chị chỉ cho con điều trị tại nhà. Đến khi thấy có các bọng nước, mụn mủ, sốt không dứt, chị mới đưa đến viện thì biết con mình bị thủy đậu.Có triệu chứng giống con chị Nh., chị Trịnh Q.A (Thanh Trì, Hà Nội) cho hay, con trai chị có biểu hiện ho, đờm họng nhiều ngày qua. Sau đó, cháu sốt liên tiếp 2 ngày không hạ. Gia đình nghĩ con sốt do viêm họng nên tự điều trị kháng sinh tại nhà nhưng con vẫn ho, sốt và bị tiêu chảy. Những nốt ban trên da bắt đầu mưng mủ, lan rộng thì chị mới đưa con tới viện.Theo bác sĩ Trần Thị Kim Anh, Trưởng Khoa Nhiệt đới, Bệnh viện Đa khoa Hà Đông, trong tuần vừa qua, số trẻ mắc thủy đậu đến khám và điều trị tại bệnh viện tăng 30% so với tháng trước.""Các trường hợp đều phải nhập viện với các dấu hiệu như sốt, đau đầu, nhức cơ, nổi ban tròn đỏ khắp cơ thể, tiến triển thành bọng nước, mụn mủ. Trẻ có kèm ho và tiêu chảy"", bác sĩ Kim Anh nói.Theo chuyên gia này, thủy đậu là bệnh truyền nhiễm do virus Varicella Zoster gây ra, số người mắc cao điểm từ tháng 3 đến tháng 5. Đây là khoảng thời gian cuối xuân đầu hè, độ ẩm không khí cao, tạo điều kiện thuận lợi cho virus gây bệnh phát tán và lây lan. Do đó, CDC Hà Nội dự báo số ca mắc có thể tiếp tục tăng trong thời gian tới.Từ đầu năm đến nay, Hà Nội ghi nhận 548 trẻ mắc thủy đậu, trong khi cùng kỳ 2022 có 4 ca, chủ yếu ở nhóm tuổi mầm non (36,5%) và tiểu học (38%).Khi bị thủy đậu, người bệnh sẽ phải trải qua 4 giai đoạn. Đó là giai đoạn ủ bệnh, giai đoạn khởi phát, giai đoạn toàn phát và giai đoạn bình phục. Tuy nhiên, khi phát hiện sớm những biểu hiện của bệnh sẽ giúp cho việc điều trị nhanh chóng và hiệu quả hơn.Một số triệu chứng cụ thể của bệnh thủy đậu người dân cần lưu ý đó là: Người bị nhiễm virus Varicella Zoster Herpes gây bệnh thủy đậu sẽ có triệu chứng sau 7-21 ngày, biểu hiện sốt, sổ mũi, đau đầu, ho nhẹ, mệt mỏi và chán ăn.Khi có những biểu hiện trên chỉ 2-3 ngày, bệnh nhân sẽ xuất hiện những nốt ban, chấm đỏ hồng trên cơ thể rồi mẩn ngứa. Sau đó sẽ xuất hiện mụn nước có kích thước bằng hạt đậu, có dịch đặc hoặc mủ bên trong. Những nốt mụn đó sẽ xẹp xuống, khô và đóng vảy sau 4-5 ngày tiếp theo.Nhiều bệnh nhi sốt, ho, tiêu chảy khi mắc thủy đậu.Nếu được điều trị tốt và kịp thời, bệnh sẽ khỏi sau 1 tuần, tuy nhiên nếu không được điều trị kịp thời bệnh sẽ kéo dài từ 2-3 tuần và để lại sẹo ở những vùng xuất hiện mụn, gây mất thẩm mỹ.Virus gây thủy đậu chủ yếu lây truyền qua đường hô hấp; giọt bắn từ mũi, miệng người bệnh; tiếp xúc trực tiếp quần áo, chăn gối của bệnh nhân; chất dịch khi các bọng nước bị vỡ.Đặc biệt, virus có thể lây cho thai nhi qua nhau thai, gây tình trạng mắc thủy đậu bẩm sinh, hoặc các dị tật. Bên cạnh đó, bệnh gây nhiều biến chứng như viêm phổi, não, điếc, động kinh, chậm phát triển tinh thần vận động.Bảo vệ trẻ em có sức đề kháng kémĐể thủy đậu nhanh chóng mất đi thì người dân không nên chữa trị tại nhà mà hãy đến gặp bác sĩ để được khám, chẩn đoán. Trường hợp bạn bị dị ứng với thành phần nào của thuốc thì hãy thông báo ngay với bác sĩ.Đối với trẻ em sức đề kháng yếu, khi bị thủy đậu bên cạnh xuất hiện các nốt mụn sẽ kèm theo hiện tượng sốt. Vì thế, các bác sĩ có thể sử dụng thuốc giảm sốt không chứa aspirin như acetaminophen có thể làm giảm triệu chứng sốt. Ngoài ra có thể dùng thuốc trị dị ứng, kem thoa như calamine,...Với những người có nguy cơ nhiễm trùng cao, hoặc người bị suy giảm hệ miễn dịch có thể sử dụng thuốc kháng virus để giảm biến chứng do thủy đậu gây ra.Bên cạnh việc dùng thuốc thì chế độ sinh hoạt phù hợp cũng rất quan trọng, ảnh hưởng đến thời gian khỏi bệnh.Do đó, nếu bị thủy đậu, tuyệt đối không sờ hay gãi các nốt mụn bị phồng lên bởi mụn có thể vỡ ra, dịch mủ có thể lây lan ra các khu vực khác. Người dân không nên kiêng tắm bởi như vậy càng làm cơ thể ngứa ngáy, khó chịu. Hãy sử dụng nước ấm để tắm rửa cho cơ thể.Nên mặc quần áo rộng rãi, thoải mái để tránh cọ xát vào nốt mụn. Tuyệt đối không tự ý mua thuốc mà hãy tham khảo ý kiến bác sĩ. Hạn chế tiếp xúc với người khác để tránh bệnh lây lan. Bổ sung các vitamin và khoáng chất giúp cơ thể tăng sức đề kháng, chống chọi lại bệnh.Người lớn cũng nằm viện vì mắc bệnh thủy đậu.Bác sĩ Kim Anh cho biết, thủy đậu là căn bệnh lây lan, truyền nhiễm qua tiếp xúc trực tiếp và qua đường hô hấp. Để phòng ngừa bệnh hiệu quả và an toàn đó là thực hiện tiêm phòng vaccine phòng ngừa thủy đậu. Đặc biệt là đối với những người chưa từng bị thủy đậu hoặc trẻ nhỏ và phụ nữ có kế hoạch mang thai cần tiêm phòng để bảo vệ sức khỏe.Theo thống kê, có hơn 90% người tiêm vaccine thủy đậu đã phòng tránh được bệnh. Vì thế, hãy chủ động bảo vệ sức khỏe của mình và người thân trong gia đình bằng cách tiêm vaccine ngừa thủy đậu.""Trẻ nhỏ mắc bệnh thủy đậu cần được vệ sinh sạch sẽ bằng cách tắm nước ấm, lau người trong phòng kín. Nếu không vệ sinh tốt, các vết phỏng dễ bị nhiễm trùng, gây tổn thương sâu qua lớp hạ bì và để lại sẹo"", bác sĩ Kim Anh nói."
" Đồng Tháp kiểm tra, chấn chỉnh nguy cơ mất an toàn lao động ","Thứ hai, ngày 27/03/2023 - 13:37",HỮU NGHĨA,https://nhandan.vn/dong-thap-kiem-tra-chan-chinh-nguy-co-mat-an-toan-lao-dong-post744895.html,"Sáng 27/3, thông tin với phóng viên Báo Nhân Dân, Giám đốc Sở Giao thông vận tải tỉnh Đồng Tháp Lê Hoàng Bảo cho biết, ông đã trực tiếp yêu cầu Ban quản lý dự án đầu tư xây dựng công trình giao thông tỉnh Đồng Tháp và đơn vị tư vấn giám sát chấn chỉnh các nhà thầu đang thi công tuyến tránh thành phố Cao Lãnh (tuyến tránh này thuộc giai đoạn 3 của dự án nâng cấp Quốc lộ 30 đoạn Cao Lãnh-Hồng Ngự).Công trình tuyến tránh Quốc lộ 30 tại xã Mỹ Trà trước đây cho bơm cát nhưng không có rào chắn, không có người giám sát, trẻ em vào tắm khu vực xả nước bơm cát. Hiện khu vực này đã được nhà thầu cho căng dây cảnh báo nguy hiểm. (Ảnh: HỮU NGHĨA)Trước đó, vào ngày 25/3, ông Lê Hoàng Bảo cũng đã đến hiện trường kiểm tra, chấn chỉnh các nhà thầu liên quan đến nội dung mà Báo Nhân Dân phản ánh. Ông Bảo cũng cho biết, Sở sẽ có thông báo kết quả kiểm tra và chỉ đạo tiếp theo liên quan đến việc khắc phục để bảo đảm an toàn lao động tại các công trình xây dựng.Theo ghi nhận của phóng viên Báo Nhân Dân, tại một số công trường xây dựng tuyến tránh ở thành phố Cao Lãnh và huyện Cao Lãnh mà phóng viên phản ánh về nguy cơ mất an toàn lao động, hiện đã được các nhà thầu cho lắp biển báo, rào chắn và căng dây cảnh báo nguy hiểm.Trước đây, phương tiện lớn dùng để thi công tuyến tránh Quốc lộ 30 băng ngang lộ nông thôn không có công nhân giám sát, báo hiệu người đi đường dẫn đến nguy cơ mất an toàn giao thông. Hiện khu vực này đã cho gắn biển báo “Công trường đang thi công, thường có xe trọng tải lớn qua lại, đề nghị mọi người chú ý”. (Ảnh: HỮU NGHĨA)Trước đó, ngày 22/3, báo Nhân Dân điện tử có bài phản ánh “Cẩu thả thi công công trình trọng điểm ở Đồng Tháp” phản ánh quá trình thi công các công trình xây dựng tuyến tránh thành phố Cao Lãnh (thuộc Dự án nâng cấp Quốc lộ 30 đoạn Cao Lãnh-Hồng Ngự) có sự cẩu thả trong công tác bảo đảm an toàn cho người và công trình, dẫn đến nguy cơ cao xảy ra tai nạn lao động.Cụ thể, phóng viên ghi nhận hoạt động mua bán tự do ngay khu vực để thiết bị máy móc, vật liệu thi công tại một công trường thuộc phường Mỹ Phú, thành phố Cao Lãnh. Nhiều khu vực tại một số công trường chưa có rào chắn bảo đảm an toàn trong xây dựng."
 Giá hàng hóa nguyên liệu biến động mạnh ,"Thứ hai, ngày 27/03/2023 - 13:36",THƯƠNG MAI,https://nhandan.vn/gia-hang-hoa-nguyen-lieu-bien-dong-manh-post744896.html,"Cà-phê Robusta tăng mạnh 6%Kết thúc tuần giao dịch 20/3-26/3, bảng giá các mặt hàng nhóm nguyên liệu công nghiệp chứng kiến sự phân hóa giữa 2 sắc xanh và đỏ. Trong đó, hai mặt hàng cà-phê đồng loạt đón nhận lực mua rất tích cực.Arabica hợp đồng tháng 5 khởi sắc sau 3 tuần giảm liên tiếp với mức tăng 1,50%, tuy vậy diễn biến trong tuần khá biến động do tác động từ việc nguồn cung chưa chắc chắn tại Brazil.Tồn kho Arabica đạt chuẩn trên Sở ICE New York giảm liên tiếp 5 phiên với 28.475 bao, về mức thấp nhất kể từ giữa tháng 12/2022, trong khi hoạt động xuất khẩu tại Brazil đang dần hồi phục nhưng chưa thực sự ổn định với tổng lượng hàng đẩy đi trong 24 ngày đầu tháng 3/2023 đạt 2,22 triệu bao, tăng mạnh so với mức 1,78 triệu bao của cùng kỳ tháng trước nhưng vẫn kém xa mức 3,31 triệu bao của tháng 3/2022. Chính điều này đã hỗ trợ giá Arabica hồi phục nhẹ trong tuần qua.Bên cạnh đó, Ngân hàng Trung ương Brazil quyết định giữ nguyên mức lãi suất cao, ở mức 13,75% và lạm phát trên cơ sở hằng tháng ở mức 0,69%, cao hơn so với mức 0,65% dự kiến, củng cố lập trường “diều hâu”. Điều này khiến đồng Real bật tăng mạnh, kéo theo tỷ giá USD/Brazil Real giảm sâu phiên cuối tuần, từ đó hạn chế nhu cầu bán hàng của nông dân nước này và góp phần thúc đẩy đà tăng cho giá Arabica.Trong khi đó, cà-phê Robusta hợp đồng tháng 5 bật tăng mạnh hơn 6% sau 2 tuần giảm liên tiếp trước đó khi thị trường lo ngại nông dân vẫn chưa thực sự đẩy mạnh việc bán hàng.Theo đó, các chuyên gia nhận định, dù nguồn cung đã được nới lỏng hơn khi Indonesia đang thu hoạch và Brazil chuẩn bị thu hoạch vào 1-2 tuần tới, nhưng trên thị trường nông dân có vẻ chưa sẵn sàng với việc đẩy hàng do ảnh hưởng từ sản lượng thấp của năm trước. Chính điều này đã hỗ trợ sự bật tăng của Robusta, đặc biệt là phiên cuối tuần với mức tăng hơn 3% so với mức tham chiếu.Đường thô hợp đồng tháng 5 ghi nhận một tuần giao dịch khá phân hóa, đóng cửa giá tăng nhẹ 0,73%. Sự trái chiều về nguồn cung tại các quốc gia cung ứng hàng đầu là nguyên nhân chính tạo nên thế trận giằng co trong tuần qua.Theo đó, thị trường vẫn tiếp tục lo ngại về sự thiếu hụt nguồn cung do các nhà máy sản xuất đường tại Ấn Độ và Thái Lan ngừng sản xuất sớm hơn bình thường, kéo theo sản lượng suy yếu so với các năm trước. Trong khi đó, việc sản lượng dự kiến nới lỏng tại Brazil với khoảng 5 triệu tấn mía trong nửa cuối tháng 3, cao gấp 5 lần so cùng kỳ năm ngoái, lại tạo ra làn sóng an tâm trên thị trường, từ đó gây sức ép, khiến sự biến động giá so với tuần trước được thu hẹp lại.Ở chiều ngược lại, bất chấp nhu cầu nhập khẩu bông đã hồi phục trong thời gian gần đây, giá mặt hàng này vẫn giảm 1,66%, khiến bông hợp đồng tháng 5 mang sắc đỏ trong 4 tuần liên tiếp.Theo báo cáo bán hàng bông của Mỹ, tính đến ngày 16/3, đã có 310.200 kiện bông được bán trong tuần với nhu cầu tiêu thụ tăng mạnh từ các nước nhập khẩu chính như Việt Nam, Trung Quốc. Điều này cho thấy dấu hiệu về sự phục hồi trong nhu cầu tiêu thụ và theo lẽ thường sẽ là nhân tố thúc đẩy giá bông khởi sắc.Dầu cọ thô ghi nhận một tuần lao dốc với mức giảm tới 10,41% so với mức tham chiếu. Bất chấp việc xuất khẩu vẫn tăng mạnh và tồn kho ở mức thấp, giá dầu cọ thô trong tuần qua chịu áp lực từ sự suy yếu từ các loại dầu khác như dầu đậu tương và dầu hướng dương.Giá đồng cao nhất 1 thángThị trường kim loại quý kết thúc một tuần giao dịch đầy tích cực với giá bạc tăng 3,9% lên 23,34 USD/ounce, giá bạch kim tăng nhẹ 0,54% lên 983,9 USD/ounce.Trong tuần qua, tin tức ảnh hưởng mạnh nhất đến nhóm kim loại quý là nội dung cuộc họp của Cục Dự trữ Liên bang Mỹ (FED). Cụ thể, các nhà chức trách đã tiến hành tăng lãi suất thêm 25 điểm cơ bản lên mức 4,75-5,0%. Mức lãi suất đỉnh của năm nay được dự báo là 5,1%, điều này đồng nghĩa với việc sẽ không còn đợt tăng lãi suất nào khác trong năm nay. Thông tin này cũng khiến cho đồng USD suy yếu và hỗ trợ cho giá kim loại quý. Chỉ số Dollar Index đóng cửa tuần giảm về 103,12 điểm.Bên cạnh đó, những rủi ro trên thị trường tài chính vẫn còn cao, và thúc đẩy các nhà đầu tư đa dạng hóa danh mục vào các loại tài sản trú ẩn an toàn. Hiện lạm phát ở khu vực châu Âu, đặc biệt là tại Anh vẫn đang vẫn chưa ngừng leo thang, và làm gia tăng thêm sức ép tăng lãi suất với các Ngân hàng Trung ương. Giá bạc hưởng lợi nhiều hơn giá bạch kim bởi vai trò trú ẩn vượt trội hơn nên nhận được nhiều lực mua hơn.Đối với nhóm kim loại cơ bản, giá đồng tăng 4,69% lên 4,08 USD/pound, mức cao nhất trong vòng một tháng. Đáng chú ý, đây cũng là tuần tăng mạnh nhất với giá đồng kể từ tuần kết thúc ngày 15/1.Bên cạnh sự suy yếu của đồng USD, sức mua trên thị trường đồng gia tăng khi mà những lo ngại về dự trữ đồng tại các Sở Giao dịch lớn. Tồn kho đồng trên Sở LME và Sở Thượng Hải lần lượt là 72.675 tấn và 81.992 tấn. Trong khi đó, tồn kho trên Sở COMEX gần như cạn kiệt khi chỉ còn dưới 15.000 tấn. Hiện các nhà xuất khẩu lớn là Chile và Peru đều gặp gián đoạn về nguồn cung và khó khăn trong việc tăng sản lượng, nên sẽ khó để bổ sung dự trữ cho các kho một cách nhanh chóng.Ngược lại, giá quặng sắt trên Sở Giao dịch Singapore giảm 8,49% về 119,68 USD/tấn. Sau khi chạm mức 130 USD/tấn, giá sắt một mặt gặp áp lực bán chốt lời. Mặt khác, sắt là kim loại cơ bản có mức tăng trưởng nhanh và mạnh nhất kể từ vùng đáy, và có phần chưa cân đối với nhu cầu tiêu thụ. Vì thế, các nhà chức trách đang cân nhắc áp dụng chính sách kiểm soát giá hàng hóa. Đồng thời, triển vọng tiêu thụ quặng sắt cũng bị ảnh hưởng khi Bắc Kinh tiếp tục duy trì các chính sách hạn chế sản lượng thép để bảo vệ môi trường.Thị trường hàng hóa dự kiến tiếp tục biến động mạnh trong tuần nàyMXV cho biết, trong tuần này, thị trường sẽ tiếp tục theo dõi sát các biến động trên thị trường tài chính nhằm đánh giá sức khỏe của các nền kinh tế lớn, trong bối cảnh lãi suất tăng cao. Điều này sẽ có tác động đáng kể tới giá hàng hóa, bởi lo ngại về rủi ro suy thoái kinh tế đang ngày càng gia tăng và khiến các nhà đầu tư thận trọng hơn trong việc mở vị thế. Tuy vậy, các thông tin về tình hình lạm phát và lãi suất cũng đã được phản ánh vào giá trong tuần trước, do đó áp lực trong tuần này cũng sẽ giảm bớt.Thị trường hàng hóa cũng mong đợi vào dữ liệu tích cực từ phía Trung Quốc, đặc biệt là chỉ số quản lý mua hàng PMI sản xuất, phản ánh hoạt động từ các nhà máy. Nhu cầu tại Trung Quốc vẫn đang được kỳ vọng sẽ là yếu tố hỗ trợ mạnh cho xu hướng giá hàng hóa trong dài hạn, dưới bối cảnh các quốc gia Bắc Mỹ và Tây Âu liên tục gặp áp lực. Trong trường hợp dữ liệu sản xuất tiếp tục biểu thị sự mở rộng, giá hàng hóa, đặc biệt là nhóm nguyên vật liệu đầu vào quan trọng như dầu thô, hay kim loại sẽ đón nhận lực mua tích cực.Riêng đối với thị trường nông sản, vào lúc 23 giờ đêm thứ sáu, Bộ Nông nghiệp Mỹ sẽ phát hành cùng lúc 2 báo cáo cực kỳ quan trọng, đó là báo cáo Tồn kho hàng quý và Triển vọng gieo trồng mùa vụ 2023/24 tại Mỹ. Như mọi năm, các số liệu này sẽ có tác động rất lớn tới giá các mặt hàng nông sản như đậu tương, ngô và lúa mì. Thậm chí các số liệu trong báo cáo Triển vọng gieo trồng có thể sẽ tạo ra 1 xu hướng lớn, kéo dài trên thị trường nông sản. Theo MXV, các nhà đầu tư cần đặc biệt theo sát các thông tin trước, trong và sau báo cáo để nâng cao hiệu quả trong hoạt động giao dịch."
